{
  "version": 0,
  "default": {
    "name": "defaut : revue",
    "description": "Tout appel qu'aucune règle ne couvre est soumis aux approbateurs.",
    "level": "revue",
    "decision": null,
    "contest_ms": 0
  },
  "rules": [
    {
      "name": "lecture autorisee",
      "description": null,
      "tools": [
        "crm__claims.get"
      ],
      "when": null,
      "level": "automatique",
      "decision": "autorise",
      "window": null,
      "contest_ms": null
    },
    {
      "name": "paiement en revue",
      "description": null,
      "tools": [
        "sap__payments.create"
      ],
      "when": {
        "path": "/amount",
        "op": "strictement_superieur",
        "value": "5000"
      },
      "level": "revue",
      "decision": null,
      "window": null,
      "contest_ms": 0
    },
    {
      "name": "paiement moyen",
      "description": null,
      "tools": [
        "sap__payments.create"
      ],
      "when": {
        "all": [
          {
            "path": "/arguments/amount",
            "op": "strictement_superieur",
            "value": "1000"
          },
          {
            "path": "/arguments/amount",
            "op": "inferieur_ou_egal",
            "value": "5000"
          }
        ]
      },
      "level": "fenetre",
      "decision": null,
      "window": {
        "duration_ms": 3600000,
        "max_calls": 5,
        "same_arguments": [
          "/arguments/beneficiary_iban"
        ]
      },
      "contest_ms": 0
    }
  ],
  "approver_set": {
    "source": "registre",
    "chain_id": 2124,
    "registry": "0xff7a89fa58a8ffa1173eb70799d7c184bf4d7fe1",
    "set": "0x35312352c0065a3fc46ce14dba05df3fcee9fbc2",
    "members": null,
    "threshold": null
  },
  "separation": {
    "self_approval": "interdite",
    "identities": [
      {
        "launched_by": "u.martin@assureur-demo.example",
        "addresses": [
          "0x90f79bf6eb2c4f870365e785982e1f101e93b906"
        ]
      }
    ]
  }
}
