{
  "version": 0,
  "default": {
    "name": "defaut : revue",
    "description": "Tout appel qu'aucune règle ne couvre est soumis aux approbateurs.",
    "level": "revue",
    "decision": null,
    "contest_ms": 0
  },
  "rules": [
    {
      "name": "virement hors CHF",
      "description": "Tout virement dont la devise n'est pas exactement la chaîne CHF est refusé.",
      "tools": [
        "sap__payments.create"
      ],
      "when": {
        "none": [
          {
            "path": "/arguments/currency",
            "op": "egal",
            "value": "CHF"
          }
        ]
      },
      "level": "automatique",
      "decision": "refuse",
      "window": null,
      "contest_ms": null
    },
    {
      "name": "virement <= 1000 CHF",
      "description": "Virement en CHF de plus de 0 et d'au plus 1000 : autorisé sans approbation.",
      "tools": [
        "sap__payments.create"
      ],
      "when": {
        "all": [
          {
            "path": "/arguments/currency",
            "op": "egal",
            "value": "CHF"
          },
          {
            "path": "/arguments/amount",
            "op": "strictement_superieur",
            "value": "0"
          },
          {
            "path": "/arguments/amount",
            "op": "inferieur_ou_egal",
            "value": "1000"
          }
        ]
      },
      "level": "automatique",
      "decision": "autorise",
      "window": null,
      "contest_ms": null
    },
    {
      "name": "virement > 1000 CHF",
      "description": "Virement en CHF de plus de 1000 : soumis aux approbateurs.",
      "tools": [
        "sap__payments.create"
      ],
      "when": {
        "all": [
          {
            "path": "/arguments/currency",
            "op": "egal",
            "value": "CHF"
          },
          {
            "path": "/arguments/amount",
            "op": "strictement_superieur",
            "value": "1000"
          }
        ]
      },
      "level": "revue",
      "decision": null,
      "window": null,
      "contest_ms": 0
    }
  ],
  "approver_set": {
    "source": "registre",
    "chain_id": 2124,
    "registry": "0xff7a89fa58a8ffa1173eb70799d7c184bf4d7fe1",
    "set": "0x35312352c0065a3fc46ce14dba05df3fcee9fbc2",
    "members": null,
    "threshold": null
  },
  "separation": {
    "self_approval": "interdite",
    "identities": [
      {
        "launched_by": "u.martin@assureur-demo.example",
        "addresses": [
          "0x90f79bf6eb2c4f870365e785982e1f101e93b906"
        ]
      }
    ]
  }
}
